{
  "subreddit": "WGUBusinessManagement",
  "name": "r/WGUBusinessManagement",
  "description": "A place where we can help one another/vent/network/etc...",
  "hierarchy": {
    "level": "program"
  },
  "isActive": true,
  "tags": [
    "business",
    "management",
    "program"
  ],
  "relevantCourses": [],
  "memberCount": 2934,
  "lastUpdated": "2025-08-11T06:50:35.879Z",
  "verified": true
}
