{
  "subreddit": "WGUIT",
  "name": "r/WGUIT",
  "description": "WGU subreddit specializing in degrees in the College of IT.",
  "hierarchy": {
    "level": "college"
  },
  "isActive": true,
  "tags": [
    "IT",
    "information technology",
    "college"
  ],
  "relevantCourses": [],
  "memberCount": 17919,
  "lastUpdated": "2025-08-11T06:50:37.022Z",
  "verified": true
}
