{
  "subreddit": "WGU_Accelerators",
  "name": "r/WGU_Accelerators",
  "description": "Go Fast\nGet Done\nDon't Cheat",
  "hierarchy": {
    "level": "community"
  },
  "isActive": true,
  "tags": [
    "acceleration",
    "study tips",
    "community"
  ],
  "relevantCourses": [],
  "memberCount": 4451,
  "lastUpdated": "2025-08-11T06:50:37.604Z",
  "verified": true
}
