{
  "subreddit": "WGUTeachersCollege",
  "name": "r/WGUTeachersCollege",
  "description": "Unofficial subreddit for WGU Teachers College.",
  "hierarchy": {
    "level": "college"
  },
  "isActive": true,
  "tags": [
    "education",
    "teaching",
    "college"
  ],
  "relevantCourses": [],
  "memberCount": 3857,
  "lastUpdated": "2025-08-11T06:54:28.233Z",
  "verified": true
}
