{
  "subreddit": "wgu_devs",
  "name": "r/wgu_devs",
  "description": "This subreddit was started to support WGU students and alumni who have started or completed either the BS in Software Engineering or the BS in Software Development, but we'd like it to be a resource and community for anyone who is taking, has taken, or is planning on taking software courses at WGU.",
  "hierarchy": {
    "level": "community"
  },
  "isActive": true,
  "tags": [
    "development",
    "programming",
    "community"
  ],
  "relevantCourses": [],
  "memberCount": 9789,
  "lastUpdated": "2025-08-11T06:50:42.360Z",
  "verified": true
}
