{
  "subreddit": "WGU",
  "name": "r/WGU",
  "description": "Place for Western Governors University students, faculty and alumni to offer positive discussions and positive support for each other.",
  "hierarchy": {
    "level": "university"
  },
  "isActive": true,
  "tags": [
    "general",
    "university"
  ],
  "relevantCourses": [],
  "memberCount": 154393,
  "lastUpdated": "2025-08-11T06:50:35.300Z",
  "verified": true
}
