{
  "subreddit": "WGU_CSA",
  "name": "r/WGU_CSA",
  "description": "WGU's B.S. Cloud Computing (formerly Cloud and Systems Administration) subreddit is for current and former students to help, share experience, or comment on anything related to cloud and systems administration.",
  "hierarchy": {
    "level": "program"
  },
  "isActive": true,
  "tags": [
    "cloud",
    "systems administration",
    "IT",
    "program"
  ],
  "relevantCourses": [],
  "memberCount": 2824,
  "lastUpdated": "2025-08-11T06:50:38.753Z",
  "verified": true
}
