{
  "subreddit": "WGUCyberSecurity",
  "name": "r/WGUCyberSecurity",
  "description": "Place for Western Governors University students in CyberSecurity and Information Assurance",
  "hierarchy": {
    "level": "program"
  },
  "isActive": true,
  "tags": [
    "cybersecurity",
    "IT",
    "program"
  ],
  "relevantCourses": [],
  "memberCount": 21941,
  "lastUpdated": "2025-08-11T06:50:36.450Z",
  "verified": true
}
