{
  "subreddit": "WGU_MSDA",
  "name": "r/WGU_MSDA",
  "description": "This is the unofficial community for the MS in Data Analytics at Western Governors University.",
  "hierarchy": {
    "level": "program"
  },
  "isActive": true,
  "tags": [
    "data analytics",
    "master's",
    "program"
  ],
  "relevantCourses": [],
  "memberCount": 3454,
  "lastUpdated": "2025-08-11T06:50:40.481Z",
  "verified": true
}
